{
  "afterRefusalIds": [
    "00000000-0000-0001-0000-000000000001",
    "4812ec2e-a136-5204-93b2-2ef2e80cee2b",
    "54500a79-67a9-575f-bd5a-d7402d098f31"
  ],
  "consumer": "kenshou-consumer",
  "decodedRows": [],
  "firstInputs": [
    {
      "attributes": {
        "sequence": 1
      },
      "causationId": "00000000-0000-0001-0000-000000000001",
      "contentType": "application/json",
      "correlationId": "00000000-0000-0002-0000-000000000001",
      "destination": "kenshou.outbox.v1",
      "eventType": "OutboxProbe",
      "kafka": {
        "offset": 1,
        "partition": 0,
        "topic": "kenshou.delegated"
      },
      "messageId": "1",
      "occurredAt": "2026-10-02T04:01:28.052645Z",
      "payloadBytes": [
        49
      ],
      "schemaReference": {
        "fingerprint": "probe-fingerprint",
        "id": 42,
        "registry": "kenshou-registry",
        "subject": "inbox-probe",
        "version": 3
      },
      "schemaVersion": 7,
      "source": "kenshou-01a0fac6-delegated-matrix-顧客",
      "sourceEventId": "00000000-0000-0000-0000-000000000001",
      "sourceGlobalPosition": 1001,
      "traceContext": {
        "parent": "00-12345678901234567890123456789012-1234567890123456-01",
        "state": "kenshou=probe"
      }
    },
    {
      "attributes": {
        "sequence": 2
      },
      "causationId": "00000000-0000-0001-0000-000000000002",
      "contentType": "application/json",
      "correlationId": "00000000-0000-0002-0000-000000000002",
      "destination": "kenshou.outbox.v1",
      "eventType": "OutboxProbe",
      "kafka": {
        "offset": 2,
        "partition": 0,
        "topic": "kenshou.delegated"
      },
      "messageId": "2",
      "occurredAt": "2026-10-02T04:01:28.056885Z",
      "payloadBytes": [
        50
      ],
      "schemaReference": {
        "fingerprint": "probe-fingerprint",
        "id": 42,
        "registry": "kenshou-registry",
        "subject": "inbox-probe",
        "version": 3
      },
      "schemaVersion": 7,
      "source": "kenshou-01a0fac6-delegated-matrix-顧客",
      "sourceEventId": null,
      "sourceGlobalPosition": 1002,
      "traceContext": {
        "parent": "00-12345678901234567890123456789012-1234567890123456-01",
        "state": "kenshou=probe"
      }
    },
    {
      "attributes": {
        "sequence": 3
      },
      "causationId": "00000000-0000-0001-0000-000000000003",
      "contentType": "application/json",
      "correlationId": "00000000-0000-0002-0000-000000000003",
      "destination": "kenshou.outbox.v1",
      "eventType": "OutboxProbe",
      "kafka": {
        "offset": 3,
        "partition": 0,
        "topic": "kenshou.delegated"
      },
      "messageId": "3",
      "occurredAt": "2026-10-02T04:01:28.058606Z",
      "payloadBytes": [
        51
      ],
      "schemaReference": {
        "fingerprint": "probe-fingerprint",
        "id": 42,
        "registry": "kenshou-registry",
        "subject": "inbox-probe",
        "version": 3
      },
      "schemaVersion": 7,
      "source": "kenshou-01a0fac6-delegated-matrix-顧客",
      "sourceEventId": "00000000-0000-0000-0000-000000000003",
      "sourceGlobalPosition": 1003,
      "traceContext": {
        "parent": "00-12345678901234567890123456789012-1234567890123456-01",
        "state": "kenshou=probe"
      }
    },
    {
      "attributes": {
        "sequence": 4
      },
      "causationId": "00000000-0000-0001-0000-000000000004",
      "contentType": "application/json",
      "correlationId": "00000000-0000-0002-0000-000000000004",
      "destination": "kenshou.outbox.v1",
      "eventType": "OutboxProbe",
      "kafka": {
        "offset": 4,
        "partition": 0,
        "topic": "kenshou.delegated"
      },
      "messageId": "4",
      "occurredAt": "2026-10-02T04:01:28.060476Z",
      "payloadBytes": [
        52
      ],
      "schemaReference": {
        "fingerprint": "probe-fingerprint",
        "id": 42,
        "registry": "kenshou-registry",
        "subject": "inbox-probe",
        "version": 3
      },
      "schemaVersion": 7,
      "source": "kenshou-01a0fac6-delegated-matrix-顧客",
      "sourceEventId": null,
      "sourceGlobalPosition": 1004,
      "traceContext": {
        "parent": "00-12345678901234567890123456789012-1234567890123456-01",
        "state": "kenshou=probe"
      }
    },
    {
      "attributes": {
        "sequence": 5
      },
      "causationId": "00000000-0000-0001-0000-000000000005",
      "contentType": "application/json",
      "correlationId": "00000000-0000-0002-0000-000000000005",
      "destination": "kenshou.outbox.v1",
      "eventType": "OutboxProbe",
      "kafka": {
        "offset": 5,
        "partition": 0,
        "topic": "kenshou.delegated"
      },
      "messageId": "5",
      "occurredAt": "2026-10-02T04:01:28.062081Z",
      "payloadBytes": [
        53
      ],
      "schemaReference": {
        "fingerprint": "probe-fingerprint",
        "id": 42,
        "registry": "kenshou-registry",
        "subject": "inbox-probe",
        "version": 3
      },
      "schemaVersion": 7,
      "source": "kenshou-01a0fac6-delegated-matrix-顧客",
      "sourceEventId": "00000000-0000-0000-0000-000000000005",
      "sourceGlobalPosition": 1005,
      "traceContext": {
        "parent": "00-12345678901234567890123456789012-1234567890123456-01",
        "state": "kenshou=probe"
      }
    },
    {
      "attributes": {
        "sequence": 6
      },
      "causationId": "00000000-0000-0001-0000-000000000006",
      "contentType": "application/json",
      "correlationId": "00000000-0000-0002-0000-000000000006",
      "destination": "kenshou.outbox.v1",
      "eventType": "OutboxProbe",
      "kafka": {
        "offset": 6,
        "partition": 0,
        "topic": "kenshou.delegated"
      },
      "messageId": "6",
      "occurredAt": "2026-10-02T04:01:28.065951Z",
      "payloadBytes": [
        54
      ],
      "schemaReference": {
        "fingerprint": "probe-fingerprint",
        "id": 42,
        "registry": "kenshou-registry",
        "subject": "inbox-probe",
        "version": 3
      },
      "schemaVersion": 7,
      "source": "kenshou-01a0fac6-delegated-matrix-顧客",
      "sourceEventId": null,
      "sourceGlobalPosition": 1006,
      "traceContext": {
        "parent": "00-12345678901234567890123456789012-1234567890123456-01",
        "state": "kenshou=probe"
      }
    },
    {
      "attributes": {
        "sequence": 7
      },
      "causationId": "00000000-0000-0001-0000-000000000007",
      "contentType": "application/json",
      "correlationId": "00000000-0000-0002-0000-000000000007",
      "destination": "kenshou.outbox.v1",
      "eventType": "OutboxProbe",
      "kafka": {
        "offset": 7,
        "partition": 0,
        "topic": "kenshou.delegated"
      },
      "messageId": "7",
      "occurredAt": "2026-10-02T04:01:28.067803Z",
      "payloadBytes": [
        55
      ],
      "schemaReference": {
        "fingerprint": "probe-fingerprint",
        "id": 42,
        "registry": "kenshou-registry",
        "subject": "inbox-probe",
        "version": 3
      },
      "schemaVersion": 7,
      "source": "kenshou-01a0fac6-delegated-matrix-顧客",
      "sourceEventId": "00000000-0000-0000-0000-000000000007",
      "sourceGlobalPosition": 1007,
      "traceContext": {
        "parent": "00-12345678901234567890123456789012-1234567890123456-01",
        "state": "kenshou=probe"
      }
    },
    {
      "attributes": {
        "sequence": 8
      },
      "causationId": "00000000-0000-0001-0000-000000000008",
      "contentType": "application/json",
      "correlationId": "00000000-0000-0002-0000-000000000008",
      "destination": "kenshou.outbox.v1",
      "eventType": "OutboxProbe",
      "kafka": {
        "offset": 8,
        "partition": 0,
        "topic": "kenshou.delegated"
      },
      "messageId": "8",
      "occurredAt": "2026-10-02T04:01:28.072042Z",
      "payloadBytes": [
        56
      ],
      "schemaReference": {
        "fingerprint": "probe-fingerprint",
        "id": 42,
        "registry": "kenshou-registry",
        "subject": "inbox-probe",
        "version": 3
      },
      "schemaVersion": 7,
      "source": "kenshou-01a0fac6-delegated-matrix-顧客",
      "sourceEventId": null,
      "sourceGlobalPosition": 1008,
      "traceContext": {
        "parent": "00-12345678901234567890123456789012-1234567890123456-01",
        "state": "kenshou=probe"
      }
    },
    {
      "attributes": {
        "sequence": 9
      },
      "causationId": "00000000-0000-0001-0000-000000000009",
      "contentType": "application/json",
      "correlationId": "00000000-0000-0002-0000-000000000009",
      "destination": "kenshou.outbox.v1",
      "eventType": "OutboxProbe",
      "kafka": {
        "offset": 9,
        "partition": 0,
        "topic": "kenshou.delegated"
      },
      "messageId": "9",
      "occurredAt": "2026-10-02T04:01:28.073555Z",
      "payloadBytes": [
        57
      ],
      "schemaReference": {
        "fingerprint": "probe-fingerprint",
        "id": 42,
        "registry": "kenshou-registry",
        "subject": "inbox-probe",
        "version": 3
      },
      "schemaVersion": 7,
      "source": "kenshou-01a0fac6-delegated-matrix-顧客",
      "sourceEventId": "00000000-0000-0000-0000-000000000009",
      "sourceGlobalPosition": 1009,
      "traceContext": {
        "parent": "00-12345678901234567890123456789012-1234567890123456-01",
        "state": "kenshou=probe"
      }
    },
    {
      "attributes": {
        "sequence": 10
      },
      "causationId": "00000000-0000-0001-0000-00000000000a",
      "contentType": "application/json",
      "correlationId": "00000000-0000-0002-0000-00000000000a",
      "destination": "kenshou.outbox.v1",
      "eventType": "OutboxProbe",
      "kafka": {
        "offset": 10,
        "partition": 0,
        "topic": "kenshou.delegated"
      },
      "messageId": "10",